{
  "version": "1.0",
  "updated_at": "2026-07-16T21:00:00-07:00",
  "active_objectives": [
    "Advance Amina to verified iOS submission",
    "Advance The Lantern Daily source registry and release path",
    "Prove Authentic Hadith submission state",
    "Keep Claudex control plane current and secure",
    "Advance Footprint strategy without crossing implementation hold"
  ],
  "sources": [
    {
      "path": "OPS/BRIDGE.json",
      "updated_at": "2026-07-14T23:59:00-07:00",
      "stale_after_days": 3
    },
    {
      "path": "OPS/TODAY.md",
      "updated_at": "2026-07-14T23:59:00-07:00",
      "stale_after_days": 3
    },
    {
      "path": "OPS/questions/INDEX.md",
      "updated_at": "2026-07-16T21:00:00-07:00",
      "stale_after_days": 3
    }
  ],
  "tasks": [
    {
      "id": "kp-lantern-schema-reconcile",
      "title": "Resolve The Lantern Daily Phase 0 schema conflicts",
      "owner": "KP",
      "project": "The Lantern Daily",
      "objective": "Advance The Lantern Daily source registry and release path",
      "outcome": "The source registry has one verified schema contract and no competing table vocabulary",
      "next_action": "Confirm the canonical tables and halal stance vocabulary, then repair the missing columns with tests",
      "definition_of_done": "Schema tests pass and a TruthCal receipt names the canonical tables, deprecated paths, and migration proof",
      "why_now": "The current intent names the Phase 0 schema bug as KP's active Lantern blocker",
      "status": "in_progress",
      "impact": 5,
      "effort": 3,
      "urgency": 5,
      "leverage": 5,
      "unblock": 5,
      "evidence_confidence": 0.85,
      "updated_at": "2026-07-14T23:59:00-07:00",
      "source": "OPS/TODAY.md"
    },
    {
      "id": "kp-authentic-hadith-submission-proof",
      "title": "Prove the Authentic Hadith submission state",
      "owner": "KP",
      "project": "Authentic Hadith",
      "objective": "Prove Authentic Hadith submission state",
      "outcome": "The exact build, subscription trial, device test result, and review state are known",
      "next_action": "Run the canonical physical device testing pack, verify the seven day trial, select the verified build, and record the resulting review state",
      "definition_of_done": "GO testing evidence, App Store Connect screenshots, build identity, and submission receipt are attached",
      "why_now": "Claudex records a reported push but the destination and review state remain unverified",
      "status": "ready",
      "impact": 5,
      "effort": 2,
      "urgency": 5,
      "leverage": 2,
      "unblock": 5,
      "evidence_confidence": 0.8,
      "updated_at": "2026-07-14T23:59:00-07:00",
      "source": "DIR-20260708-CDX-01"
    },
    {
      "id": "kp-pe-live-automation-proof",
      "title": "Attach live Make Grid and n8n evidence for Penn Enterprises",
      "owner": "KP",
      "project": "Penn Enterprises automation",
      "objective": "Keep Claudex control plane current and secure",
      "outcome": "Claudex can distinguish the verified live automation inventory from blueprint claims",
      "next_action": "Provide the Make Grid organization receipt, exact automation list, and authenticated n8n readback",
      "definition_of_done": "The discovery queue cites current live evidence and removes unsupported client facing claims",
      "why_now": "The PE discovery lane is active but remains PARTIAL without live provider evidence",
      "status": "ready",
      "impact": 4,
      "effort": 2,
      "urgency": 4,
      "leverage": 4,
      "unblock": 4,
      "evidence_confidence": 0.75,
      "updated_at": "2026-07-14T23:59:00-07:00",
      "source": "DIR-20260707-08"
    },
    {
      "id": "kp-codex-cost-setup",
      "title": "Verify the Keymon Codex cost setup",
      "owner": "KP",
      "project": "Claudex",
      "objective": "Keep Claudex control plane current and secure",
      "outcome": "KP's Codex uses the approved cost routing without a global API key export",
      "next_action": "Apply OPS/KEYMON_CODEX_COST_SETUP_20260708.md on KP's machine and run the verification checks",
      "definition_of_done": "A current verification receipt records the model default, secret boundary, and check output",
      "why_now": "The Claudex lane and owner directive are still open and the work is low effort",
      "status": "ready",
      "impact": 3,
      "effort": 1,
      "urgency": 3,
      "leverage": 5,
      "unblock": 3,
      "evidence_confidence": 0.9,
      "updated_at": "2026-07-14T23:59:00-07:00",
      "source": "DIR-20260708-HB-01"
    },
    {
      "id": "kp-answer-desk-install",
      "title": "Install the KP answer desk sweep",
      "owner": "KP",
      "project": "Claudex",
      "objective": "Keep Claudex control plane current and secure",
      "outcome": "Questions addressed to KP's engine are answered within the operating window",
      "next_action": "Install the hourly answer desk prompt from OPS/QA_PROTOCOL.md and prove one sweep",
      "definition_of_done": "The schedule exists and one addressed question is read, classified, and updated with evidence",
      "why_now": "The setup removes a repeated cross machine handoff delay with one small action",
      "status": "ready",
      "impact": 3,
      "effort": 1,
      "urgency": 3,
      "leverage": 4,
      "unblock": 3,
      "evidence_confidence": 0.8,
      "updated_at": "2026-07-14T23:59:00-07:00",
      "source": "DIR-20260707-10"
    },
    {
      "id": "rory-amina-ios-repair",
      "title": "Close the active Amina iOS repair path",
      "owner": "Rory",
      "project": "Amina",
      "objective": "Advance Amina to verified iOS submission",
      "outcome": "A repaired Amina build reaches a verified build or submission state",
      "next_action": "Finish the current repair, run the device and release checks, and record the next build or submission result",
      "definition_of_done": "Build identity, test output, device evidence, and App Store or TestFlight state are receipted",
      "why_now": "Amina is the studio focus and the active release path",
      "status": "in_progress",
      "impact": 5,
      "effort": 3,
      "urgency": 5,
      "leverage": 4,
      "unblock": 5,
      "evidence_confidence": 0.9,
      "updated_at": "2026-07-14T23:59:00-07:00",
      "source": "OPS/BRIDGE.json"
    },
    {
      "id": "rory-authentic-hadith-push-receipt",
      "title": "Receipt the Authentic Hadith push",
      "owner": "Rory",
      "project": "Authentic Hadith",
      "objective": "Prove Authentic Hadith submission state",
      "outcome": "The reported push has an exact destination and resulting state",
      "next_action": "Record whether the push reached GitHub, TestFlight, or App Store review and attach the exact build identity",
      "definition_of_done": "A receipt links the destination, build, test result, and external review state",
      "why_now": "The push is reported but cannot yet support a release claim",
      "status": "ready",
      "impact": 5,
      "effort": 1,
      "urgency": 5,
      "leverage": 2,
      "unblock": 5,
      "evidence_confidence": 0.8,
      "updated_at": "2026-07-14T23:59:00-07:00",
      "source": "OPS/BRIDGE.json"
    },
    {
      "id": "rory-rotate-exposed-provider-keys",
      "title": "Rotate exposed provider keys",
      "owner": "Rory",
      "project": "Claudex security",
      "objective": "Keep Claudex control plane current and secure",
      "outcome": "Previously exposed OpenAI, Notion, Resend, and v0 credentials no longer authorize access",
      "next_action": "Rotate each flagged key at its provider and update only the protected secret locations",
      "definition_of_done": "Old keys fail, new keys work from protected stores, and no committed file contains values",
      "why_now": "Credential exposure is a standing security warning with direct account impact",
      "status": "ready",
      "impact": 5,
      "effort": 2,
      "urgency": 5,
      "leverage": 4,
      "unblock": 5,
      "evidence_confidence": 0.9,
      "updated_at": "2026-07-14T23:59:00-07:00",
      "source": "OPS/BRIDGE.json"
    },
    {
      "id": "rory-relocate-api-key-vault",
      "title": "Move live credentials outside the Claudex tree",
      "owner": "Rory",
      "project": "Claudex security",
      "objective": "Keep Claudex control plane current and secure",
      "outcome": "No live credential value is stored anywhere inside the repository tree",
      "next_action": "Select the protected host location, move values, preserve pointer only documentation, and run the secret scan",
      "definition_of_done": "The vault file is absent from the repo tree, provider pointers remain valid, and npm run check passes",
      "why_now": "The current bridge warns that local live credentials still sit under the repository path",
      "status": "ready",
      "impact": 5,
      "effort": 2,
      "urgency": 5,
      "leverage": 4,
      "unblock": 4,
      "evidence_confidence": 0.8,
      "updated_at": "2026-07-14T23:59:00-07:00",
      "source": "DIR-20260707-05"
    },
    {
      "id": "rory-decide-swarmclaw-routing",
      "title": "Resolve the SwarmClaw routing conflict",
      "owner": "Rory",
      "project": "SwarmClaw",
      "objective": "Keep Claudex control plane current and secure",
      "outcome": "The live runtime and tracked routing policy agree on one approved model plan",
      "next_action": "Choose Gemini or Ollama routing, verify the live runtime, and preserve the selected policy with evidence",
      "definition_of_done": "Runtime readback, tracked policy, org chart, and receipt all agree",
      "why_now": "Two conflicting routing truths remain open and can silently misroute the agent fleet",
      "status": "ready",
      "impact": 4,
      "effort": 2,
      "urgency": 4,
      "leverage": 5,
      "unblock": 4,
      "evidence_confidence": 0.8,